{
  "schema_version": 1,
  "id": "deep-3",
  "version": "1.0.0",
  "label": "Deep 3",
  "author": "krellbot tests",
  "timeframe": "1h",
  "indicators": {
    "a": {
      "fn": "sma",
      "src": "close",
      "len": 5
    },
    "b": {
      "fn": "sma",
      "src": "close",
      "len": 5
    }
  },
  "entry": {
    "all": [
      {
        "all": [
          [
            "close",
            ">",
            "a"
          ]
        ]
      }
    ]
  },
  "exit": [
    "close",
    "<",
    "b"
  ],
  "risk": {
    "max_account_pct": 25,
    "stop": {
      "type": "pct",
      "pct": 5
    }
  },
  "markets": [
    {
      "venue": "kraken",
      "pair": "SUIUSD"
    }
  ]
}
