{
  "schema_version": 1,
  "id": "atr-stop",
  "version": "1.0.0",
  "label": "ATR stop",
  "author": "krellbot tests",
  "timeframe": "1h",
  "indicators": {
    "sma20": {
      "fn": "sma",
      "src": "close",
      "len": 20
    }
  },
  "entry": [
    "close",
    ">",
    "sma20"
  ],
  "exit": [
    "close",
    "<",
    "sma20"
  ],
  "risk": {
    "max_account_pct": 25,
    "stop": {
      "type": "atr",
      "len": 14,
      "mult": 2
    }
  },
  "markets": [
    {
      "venue": "kraken",
      "pair": "SUIUSD"
    }
  ]
}
