{
  "schema_version": 1,
  "id": "trend-follow",
  "version": "1.0.0",
  "label": "Trend follow",
  "author": "krellbot tests",
  "timeframe": "1h",
  "origin": "Test fixture.",
  "indicators": {
    "sma20": {
      "fn": "sma",
      "src": "close",
      "len": 20
    }
  },
  "entry": [
    "close",
    ">",
    "sma20"
  ],
  "exit": [
    "close",
    "<",
    "sma20"
  ],
  "risk": {
    "max_account_pct": 25,
    "stop": {
      "type": "pct",
      "pct": 5
    }
  },
  "markets": [
    {
      "venue": "kraken",
      "pair": "SUIUSD"
    }
  ]
}
